{
  "at": "2026-10-12T18:30:00Z",
  "eater": "you",
  "id": "3c4d5e6f-1111-4c00-8d00-000000000001",
  "ingredient": null,
  "kind": "recipe_viewed",
  "payload": {
    "exposureId": "1a2b3c4d-0001-4a00-8b00-000000000001",
    "slatePosition": 1
  },
  "recipe": {
    "id": "1",
    "revision": 1,
    "source": "catalog"
  },
  "surface": "home.tonight"
}
